{
  "schema_version": 1,
  "change": "senline-service-dogfood",
  "linked_senline_change": "adopt-sengoo-backend-slice",
  "records": [
    {
      "record_id": "SGDOG-2026-001",
      "senline_failure": {
        "failure_id": "SGDOG-2026-001",
        "change": "adopt-sengoo-backend-slice",
        "fixture": "fixtures/sengoo-worker/v1/cases/eligible-accept.request.json",
        "fixture_mirror": "examples/realworld/senline-domain-worker/fixtures/v1/cases/eligible-accept.request.json",
        "fixture_sha256": "398159a680fec4f9724f5d4ed09a461da97a627146c4469fe936c5efc8c3f575",
        "evidence_kind": "known-baseline-rehearsal",
        "consumer_record": "docs/senline-dogfood-defects.md",
        "consumer_record_sha256": "1f1a2c300c13ff7f4f99d3553179f4137672050ae9b417256e22e92d7b2294e0"
      },
      "ownership": {
        "authority": "sengoo-owned",
        "component_classification": "sengoo-standard-library",
        "owner": "Sengoo runtime and standard library",
        "discovery_status": "known-baseline"
      },
      "minimized_regression": {
        "repository": "Sengoo",
        "test": "tools/sgc/src/tests.rs::stdlib_buffer_zeroes_gaps_before_exposing_extended_bytes",
        "selector": {
          "package": "sgc",
          "target_kind": "bin",
          "target_name": "sgc",
          "test_name": "tests::stdlib_buffer_zeroes_gaps_before_exposing_extended_bytes"
        },
        "red_command": "cargo test -p sgc --bin sgc tests::stdlib_buffer_zeroes_gaps_before_exposing_extended_bytes -- --exact --nocapture",
        "red_status": "pending-commit",
        "red_commit": null
      },
      "fix": {
        "summary": "Zero every newly exposed Buffer gap before advancing used_len.",
        "fixing_commit": null,
        "affected_gates": [
          "cargo test -p sgc --bin sgc tests::stdlib_buffer_zeroes_gaps_before_exposing_extended_bytes -- --exact --nocapture"
        ],
        "rejected_workarounds": [
          "Do not require every protocol caller to pre-zero full Buffer capacity."
        ],
        "remaining_platform_gaps": [
          "Clean immutable Windows and Linux installed artifacts are not built yet.",
          "The linked Senline pin and final consumer gate are not available yet."
        ]
      },
      "target_artifacts": [
        {
          "target": "x86_64-pc-windows-msvc",
          "status": "pending",
          "source_revision": null,
          "build_manifest_id": null,
          "provenance": null,
          "archive": null,
          "manifest": null,
          "archive_sha256": null,
          "manifest_sha256": null
        },
        {
          "target": "x86_64-unknown-linux-gnu",
          "status": "pending",
          "source_revision": null,
          "build_manifest_id": null,
          "provenance": null,
          "archive": null,
          "manifest": null,
          "archive_sha256": null,
          "manifest_sha256": null
        }
      ],
      "senline_pin": {
        "status": "pending",
        "senline_pin_revision": null,
        "pinned_sengoo_revision": null,
        "target_manifests": []
      },
      "final_consumer_gate": {
        "status": "pending",
        "command": "cargo test --locked --workspace",
        "evidence": null
      },
      "workaround": {
        "active": false,
        "owner": null,
        "linked_defect": null,
        "expiry_condition": null,
        "removal_test": null
      }
    },
    {
      "record_id": "SGDOG-2026-014",
      "senline_failure": {
        "failure_id": "SGDOG-2026-014",
        "change": "adopt-sengoo-backend-slice",
        "fixture": "fixtures/sengoo-worker/v1/cases/eligible-accept.request.json",
        "fixture_mirror": "examples/realworld/senline-domain-worker/fixtures/v1/cases/eligible-accept.request.json",
        "fixture_sha256": "398159a680fec4f9724f5d4ed09a461da97a627146c4469fe936c5efc8c3f575",
        "evidence_kind": "consumer-failure",
        "consumer_record": "docs/senline-dogfood-defects.md",
        "consumer_record_sha256": "1f1a2c300c13ff7f4f99d3553179f4137672050ae9b417256e22e92d7b2294e0"
      },
      "ownership": {
        "authority": "sengoo-owned",
        "component_classification": "sengoo-package-toolchain",
        "owner": "Sengoo sgpm",
        "discovery_status": "consumer-discovered"
      },
      "minimized_regression": {
        "repository": "Sengoo",
        "test": "tools/sgpm/tests/integration.rs::sgpm_check_exposes_transitive_dependency_library_module_map",
        "selector": {
          "package": "sgpm",
          "target_kind": "test",
          "target_name": "integration",
          "test_name": "sgpm_check_exposes_transitive_dependency_library_module_map"
        },
        "red_command": "cargo test -p sgpm --test integration sgpm_check_exposes_transitive_dependency_library_module_map -- --exact --nocapture",
        "red_status": "pending-commit",
        "red_commit": null
      },
      "fix": {
        "summary": "Expose the selected package's deterministic transitive library module map and reject conflicting aliases.",
        "fixing_commit": null,
        "affected_gates": [
          "cargo test -p sgpm --test integration transitive -- --nocapture",
          "sgpm --runtime-mode source-development test --locked"
        ],
        "rejected_workarounds": [
          "Do not duplicate every worker-internal dependency in the HTTP product manifest."
        ],
        "remaining_platform_gaps": [
          "Clean installed Windows and Linux package loops are not complete.",
          "The linked Senline pin and final consumer gate are not available yet."
        ]
      },
      "target_artifacts": [
        {
          "target": "x86_64-pc-windows-msvc",
          "status": "pending",
          "source_revision": null,
          "build_manifest_id": null,
          "provenance": null,
          "archive": null,
          "manifest": null,
          "archive_sha256": null,
          "manifest_sha256": null
        },
        {
          "target": "x86_64-unknown-linux-gnu",
          "status": "pending",
          "source_revision": null,
          "build_manifest_id": null,
          "provenance": null,
          "archive": null,
          "manifest": null,
          "archive_sha256": null,
          "manifest_sha256": null
        }
      ],
      "senline_pin": {
        "status": "pending",
        "senline_pin_revision": null,
        "pinned_sengoo_revision": null,
        "target_manifests": []
      },
      "final_consumer_gate": {
        "status": "pending",
        "command": "cargo test --locked --workspace",
        "evidence": null
      },
      "workaround": {
        "active": false,
        "owner": null,
        "linked_defect": null,
        "expiry_condition": null,
        "removal_test": null
      }
    },
    {
      "record_id": "SGDOG-2026-015",
      "senline_failure": {
        "failure_id": "SGDOG-2026-015",
        "change": "adopt-sengoo-backend-slice",
        "fixture": "fixtures/sengoo-worker/v1/cases/eligible-accept.request.json",
        "fixture_mirror": "examples/realworld/senline-domain-worker/fixtures/v1/cases/eligible-accept.request.json",
        "fixture_sha256": "398159a680fec4f9724f5d4ed09a461da97a627146c4469fe936c5efc8c3f575",
        "evidence_kind": "consumer-failure",
        "consumer_record": "docs/senline-dogfood-defects.md",
        "consumer_record_sha256": "1f1a2c300c13ff7f4f99d3553179f4137672050ae9b417256e22e92d7b2294e0"
      },
      "ownership": {
        "authority": "sengoo-owned",
        "component_classification": "sengoo-standard-library",
        "owner": "Sengoo runtime and standard library",
        "discovery_status": "consumer-discovered"
      },
      "minimized_regression": {
        "repository": "Sengoo",
        "test": "tools/sgc/tests/http_request_strings.rs::real_sgc_http_request_owned_string_accessors_are_safe",
        "selector": {
          "package": "sgc",
          "target_kind": "test",
          "target_name": "http_request_strings",
          "test_name": "real_sgc_http_request_owned_string_accessors_are_safe"
        },
        "red_command": "cargo test -p sgc --test http_request_strings real_sgc_http_request_owned_string_accessors_are_safe -- --exact --nocapture",
        "red_status": "pending-commit",
        "red_commit": null
      },
      "fix": {
        "summary": "Preserve exact length metadata for HTTP request copies and construct owned request strings from explicit byte lengths.",
        "fixing_commit": null,
        "affected_gates": [
          "cargo test -p sgc --test http_request_strings -- --nocapture",
          "sgpm --runtime-mode source-development test --locked"
        ],
        "rejected_workarounds": [
          "Do not let each HTTP consumer allocate a second Buffer or bypass strict JSON length checks."
        ],
        "remaining_platform_gaps": [
          "The complete malformed, segmented, and large-request localhost matrix is pending.",
          "Clean installed Windows and Linux package loops and the Senline pin are pending."
        ]
      },
      "target_artifacts": [
        {
          "target": "x86_64-pc-windows-msvc",
          "status": "pending",
          "source_revision": null,
          "build_manifest_id": null,
          "provenance": null,
          "archive": null,
          "manifest": null,
          "archive_sha256": null,
          "manifest_sha256": null
        },
        {
          "target": "x86_64-unknown-linux-gnu",
          "status": "pending",
          "source_revision": null,
          "build_manifest_id": null,
          "provenance": null,
          "archive": null,
          "manifest": null,
          "archive_sha256": null,
          "manifest_sha256": null
        }
      ],
      "senline_pin": {
        "status": "pending",
        "senline_pin_revision": null,
        "pinned_sengoo_revision": null,
        "target_manifests": []